{
  "event_id": "7371cc18-ed9c-59fc-b218-7e5b02970c6f",
  "type": "PassportMeasureAdded",
  "version": 1,
  "entrance_id": "9f1a2b3c-0000-4000-8000-000000000001",
  "occurred_at": "2026-09-13T08:00:00Z",
  "causation_id": null,
  "correlation_id": "9f1a2b3c-0000-4000-8000-0000000000ff",
  "law_version": "1.3",
  "producer": "maintenance",
  "payload": {
    "passport_id": "de69b1a2-8ba7-53f0-9862-feb7241ae455",
    "measure_code": "example",
    "due_on": "2026-09-13"
  }
}
