{
  "event_id": "076943f4-41a4-5426-a01a-a294a37e2d51",
  "type": "ComplianceTaskRaised",
  "version": 1,
  "entrance_id": "9f1a2b3c-0000-4000-8000-000000000001",
  "occurred_at": "2026-09-13T08:00:00Z",
  "causation_id": null,
  "correlation_id": "9f1a2b3c-0000-4000-8000-0000000000ff",
  "law_version": "1.3",
  "producer": "compliance",
  "payload": {
    "task_id": "de69b1a2-8ba7-53f0-9862-feb7241ae455",
    "obligation_code": "example",
    "due_on": "2026-09-13",
    "rule_id": "PM-FEE-002"
  }
}
