{
  "event_id": "caaa3622-11e5-5baf-a194-5101d1b5adc7",
  "type": "TitleTransferred",
  "version": 1,
  "entrance_id": "9f1a2b3c-0000-4000-8000-000000000001",
  "occurred_at": "2026-09-13T08:00:00Z",
  "causation_id": null,
  "correlation_id": "9f1a2b3c-0000-4000-8000-0000000000ff",
  "law_version": "1.3",
  "producer": "identity-org",
  "payload": {
    "unit_id": "de69b1a2-8ba7-53f0-9862-feb7241ae455",
    "from_party_id": "de69b1a2-8ba7-53f0-9862-feb7241ae455",
    "to_party_id": "de69b1a2-8ba7-53f0-9862-feb7241ae455",
    "effective_from": "2026-09-13"
  }
}
