{
  "event_id": "4aa30f58-7d4d-5bdf-8ae5-4c83f410d904",
  "type": "DecisionTaken",
  "version": 1,
  "entrance_id": "9f1a2b3c-0000-4000-8000-000000000001",
  "occurred_at": "2026-09-13T08:00:00Z",
  "causation_id": null,
  "correlation_id": "9f1a2b3c-0000-4000-8000-0000000000ff",
  "law_version": "1.3",
  "producer": "assembly",
  "payload": {
    "decision_id": "de69b1a2-8ba7-53f0-9862-feb7241ae455",
    "assembly_id": "de69b1a2-8ba7-53f0-9862-feb7241ae455",
    "session_no": 3,
    "agenda_item": "example",
    "majority_rule": "example",
    "denominator": "REPRESENTED",
    "threshold": "12.345600",
    "tally_for": "12.345600",
    "tally_against": "12.345600",
    "status": "example",
    "execution_due": "2026-09-13",
    "law_version": "example"
  }
}
