{
  "event_id": "0c4cde6e-a048-5c48-aec0-364c2495a060",
  "type": "AssemblyConvened",
  "version": 1,
  "entrance_id": "9f1a2b3c-0000-4000-8000-000000000001",
  "occurred_at": "2026-09-13T08:00:00Z",
  "causation_id": null,
  "correlation_id": "9f1a2b3c-0000-4000-8000-0000000000ff",
  "law_version": "1.3",
  "producer": "assembly",
  "payload": {
    "assembly_id": "de69b1a2-8ba7-53f0-9862-feb7241ae455",
    "convened_by": "de69b1a2-8ba7-53f0-9862-feb7241ae455",
    "scheduled_for": "2026-09-13T08:00:00Z",
    "agenda_item_count": 3,
    "urgent": true
  }
}
