{
  "event_id": "477682e5-ec3e-5145-b70a-98f99818d007",
  "type": "DeliveryFailed",
  "version": 1,
  "entrance_id": "9f1a2b3c-0000-4000-8000-000000000001",
  "occurred_at": "2026-09-13T08:00:00Z",
  "causation_id": null,
  "correlation_id": "9f1a2b3c-0000-4000-8000-0000000000ff",
  "law_version": "1.3",
  "producer": "notify",
  "payload": {
    "notice_id": "de69b1a2-8ba7-53f0-9862-feb7241ae455",
    "party_id": "de69b1a2-8ba7-53f0-9862-feb7241ae455",
    "channel": "example",
    "failed_at": "2026-09-13T08:00:00Z",
    "reason": "example"
  }
}
