{
  "event_id": "34973548-7846-592f-be7c-644c2ca43970",
  "type": "FundDisbursed",
  "version": 1,
  "entrance_id": "9f1a2b3c-0000-4000-8000-000000000001",
  "occurred_at": "2026-09-13T08:00:00Z",
  "causation_id": null,
  "correlation_id": "9f1a2b3c-0000-4000-8000-0000000000ff",
  "law_version": "1.3",
  "producer": "money",
  "payload": {
    "disbursement_id": "de69b1a2-8ba7-53f0-9862-feb7241ae455",
    "work_order_id": "de69b1a2-8ba7-53f0-9862-feb7241ae455",
    "amount": {
      "amount_minor": 4250,
      "currency": "EUR"
    },
    "authorised_by": "de69b1a2-8ba7-53f0-9862-feb7241ae455",
    "decision_id": "de69b1a2-8ba7-53f0-9862-feb7241ae455"
  }
}
