{
  "event_id": "6e2a1fe7-73f9-50d5-9405-01b78bed4f2c",
  "type": "SessionOpened",
  "version": 1,
  "entrance_id": "9f1a2b3c-0000-4000-8000-000000000001",
  "occurred_at": "2026-09-13T08:00:00Z",
  "causation_id": null,
  "correlation_id": "9f1a2b3c-0000-4000-8000-0000000000ff",
  "law_version": "1.3",
  "producer": "assembly",
  "payload": {
    "assembly_id": "de69b1a2-8ba7-53f0-9862-feb7241ae455",
    "session_no": 3,
    "represented_ideal_parts": "12.345600",
    "quorum_met": true,
    "quorum_threshold": "12.345600"
  }
}
