{
  "event_id": "6c485c32-5168-587c-ad00-7abc31851e0f",
  "type": "WorkOrderRaised",
  "version": 1,
  "entrance_id": "9f1a2b3c-0000-4000-8000-000000000001",
  "occurred_at": "2026-09-13T08:00:00Z",
  "causation_id": null,
  "correlation_id": "9f1a2b3c-0000-4000-8000-0000000000ff",
  "law_version": "1.3",
  "producer": "maintenance",
  "payload": {
    "work_order_id": "de69b1a2-8ba7-53f0-9862-feb7241ae455",
    "asset_id": "de69b1a2-8ba7-53f0-9862-feb7241ae455",
    "work_class": "example",
    "estimated": {
      "amount_minor": 4250,
      "currency": "EUR"
    }
  }
}
