{
  "event_id": "cf90feee-dbd6-5d8a-87b8-dce91c257921",
  "type": "ConstantAdded",
  "version": 1,
  "entrance_id": "9f1a2b3c-0000-4000-8000-000000000001",
  "occurred_at": "2026-09-13T08:00:00Z",
  "causation_id": null,
  "correlation_id": "9f1a2b3c-0000-4000-8000-0000000000ff",
  "law_version": "1.3",
  "producer": "law",
  "payload": {
    "code": "example",
    "value": "example",
    "in_force_from": "2026-09-13",
    "source": "example"
  }
}
