{
  "event_id": "92b648c6-29a1-5f74-b5b1-019fa2bb3806",
  "type": "NoticePosted",
  "version": 1,
  "entrance_id": "9f1a2b3c-0000-4000-8000-000000000001",
  "occurred_at": "2026-09-13T08:00:00Z",
  "causation_id": null,
  "correlation_id": "9f1a2b3c-0000-4000-8000-0000000000ff",
  "law_version": "1.3",
  "producer": "notify",
  "payload": {
    "notice_id": "de69b1a2-8ba7-53f0-9862-feb7241ae455",
    "act_kind": "example",
    "posted_at": "2026-09-13T08:00:00Z",
    "evidence_document_id": "de69b1a2-8ba7-53f0-9862-feb7241ae455",
    "co_signed_by": "de69b1a2-8ba7-53f0-9862-feb7241ae455"
  }
}
