{
  "event_id": "e7a76e48-7de8-59bb-91f1-676e7f09693e",
  "type": "MandateExpired",
  "version": 1,
  "entrance_id": "9f1a2b3c-0000-4000-8000-000000000001",
  "occurred_at": "2026-09-13T08:00:00Z",
  "causation_id": null,
  "correlation_id": "9f1a2b3c-0000-4000-8000-0000000000ff",
  "law_version": "1.3",
  "producer": "identity-org",
  "payload": {
    "party_id": "de69b1a2-8ba7-53f0-9862-feb7241ae455",
    "role": "example",
    "expired_on": "2026-09-13"
  }
}
