{
  "event_id": "a40365c1-f7b4-5c58-b8bc-21bf76e89666",
  "type": "FilingSubmitted",
  "version": 1,
  "entrance_id": "9f1a2b3c-0000-4000-8000-000000000001",
  "occurred_at": "2026-09-13T08:00:00Z",
  "causation_id": null,
  "correlation_id": "9f1a2b3c-0000-4000-8000-0000000000ff",
  "law_version": "1.3",
  "producer": "compliance",
  "payload": {
    "filing_id": "de69b1a2-8ba7-53f0-9862-feb7241ae455",
    "authority": "example",
    "filing_kind": "example",
    "submitted_at": "2026-09-13T08:00:00Z"
  }
}
