{
  "event_id": "c94c5b98-3d12-5172-b0ec-11744c472410",
  "type": "ChargeIssued",
  "version": 1,
  "entrance_id": "9f1a2b3c-0000-4000-8000-000000000001",
  "occurred_at": "2026-09-13T08:00:00Z",
  "causation_id": null,
  "correlation_id": "9f1a2b3c-0000-4000-8000-0000000000ff",
  "law_version": "1.3",
  "producer": "money",
  "payload": {
    "charge_run_id": "de69b1a2-8ba7-53f0-9862-feb7241ae455",
    "unit_id": "de69b1a2-8ba7-53f0-9862-feb7241ae455",
    "period": "example",
    "amount": {
      "amount_minor": 4250,
      "currency": "EUR"
    },
    "basis_hash": "example",
    "law_version": "example",
    "engine_version": "example"
  }
}
