{
  "event_id": "5b02dab6-b756-59a7-b960-edf165d3f6b4",
  "type": "ArrearAged",
  "version": 1,
  "entrance_id": "9f1a2b3c-0000-4000-8000-000000000001",
  "occurred_at": "2026-09-13T08:00:00Z",
  "causation_id": null,
  "correlation_id": "9f1a2b3c-0000-4000-8000-0000000000ff",
  "law_version": "1.3",
  "producer": "money",
  "payload": {
    "unit_id": "de69b1a2-8ba7-53f0-9862-feb7241ae455",
    "amount": {
      "amount_minor": 4250,
      "currency": "EUR"
    },
    "bucket": "example",
    "due_since": "2026-09-13"
  }
}
