{
  "event_id": "425e926e-7a56-5bcd-8dbd-40cd4d4ebd67",
  "type": "LawSourceChanged",
  "version": 1,
  "entrance_id": "9f1a2b3c-0000-4000-8000-000000000001",
  "occurred_at": "2026-09-13T08:00:00Z",
  "causation_id": null,
  "correlation_id": "9f1a2b3c-0000-4000-8000-0000000000ff",
  "law_version": "1.3",
  "producer": "law",
  "payload": {
    "source_id": "example",
    "articles": [
      "example"
    ],
    "impacted_rules": [
      "PM-FEE-002"
    ],
    "retrieved_at": "2026-09-13T08:00:00Z"
  }
}
