{
  "event_id": "92dcaea8-2b25-5dd3-8e9e-506b053a9e43",
  "type": "ImportCommitted",
  "version": 1,
  "entrance_id": "9f1a2b3c-0000-4000-8000-000000000001",
  "occurred_at": "2026-09-13T08:00:00Z",
  "causation_id": null,
  "correlation_id": "9f1a2b3c-0000-4000-8000-0000000000ff",
  "law_version": "1.3",
  "producer": "intake",
  "payload": {
    "import_id": "de69b1a2-8ba7-53f0-9862-feb7241ae455",
    "source_document_id": "de69b1a2-8ba7-53f0-9862-feb7241ae455",
    "rows_created": 3,
    "rows_changed": 3,
    "committed_by": "de69b1a2-8ba7-53f0-9862-feb7241ae455"
  }
}
